{
  "configuration_change_context_id": "CCR-EVT-U2-2024-0847",
  "event_id": "EVT-U2-2024-0847",
  "asset_id": "U2-CONDENSER-MAIN",
  "generated_at": "2024-07-14T06:00:00Z",
  "records": [
    {
      "change_id": "CCR-WO-2024-11847",
      "change_type": "other",
      "status": "implemented",
      "implemented_at": "2024-06-23T16:00:00Z",
      "reverted_at": null,
      "component_ids": [
        "U2-CND-WATERBOX-A",
        "U2-CND-TUBE-BUNDLE-A"
      ],
      "system_ids": [
        "secondary-side-condenser"
      ],
      "summary": "Condenser Waterbox A tube cleaning and inspection per annual PM schedule. 847 tubes inspected. As-found tube cleanliness score: 0.94/1.0. Zero tubes plugged. As-left: acceptable. No fouling or biological growth found. This maintenance record contradicts the tube fouling hypothesis.",
      "reason": "scheduled preventive maintenance per PM-U2-CND-TUBE-INSP-A",
      "approver": "U2-OUTAGE-ENGINEERING",
      "document_refs": [
        "WO-2024-11847",
        "SOP-U2-CND-001"
      ]
    },
    {
      "change_id": "CCR-WO-2024-11901",
      "change_type": "other",
      "status": "planned",
      "implemented_at": "2024-07-10T11:30:00Z",
      "reverted_at": null,
      "component_ids": [
        "U2-HVAC-TURBINE-BAY-FAN-A"
      ],
      "system_ids": [
        "turbine-building-hvac"
      ],
      "summary": "HVAC turbine bay fan A motor bearing replacement \u2014 corrective maintenance. Bearing failure attributed to PM overdue 60 days. Fan A tripped on high vibration (0.89 in/s). Fan B in service for interim ventilation. Parts on order; work not completed at time of main event.",
      "reason": "corrective action following fan A trip on high vibration 2024-07-10",
      "approver": null,
      "document_refs": [
        "WO-2024-11901"
      ]
    }
  ],
  "quality": {
    "coverage_status": "complete",
    "quality_flags": []
  },
  "provenance": {
    "generated_by": "show-and-tell-fixture-generator",
    "query_params": {
      "test_case": "TC-3",
      "scenario": "condenser-vacuum-loss-pwr-u2"
    }
  }
}